{
  "legalID1": "BCG80726",
  "legalIssueDate1": "20161227",
  "legalExpiryDate1": "20261226",
  "legalID2": "BCG80727",
  "legalIssueDate2": "20161227",
  "legalExpiryDate2": "20261225",
  "residence": "",
  "townCountry1": "TEST",
  "townCountry2": "عمان الغريبة",
  "streetName1": "TEST",
  "streetName2": "عمان الغريبة",
  "phoneNumber1": "+971555259447",
  "phoneNumber2": "+971555259448",
  "phoneNumber3": "+971555259449",
  "occupation1": "OCC1",
  "occupation2": "OCC2",
  "occupation3": "OCC3",
  "employersName1": "TEST1",
  "employersName2": "TEST2",
  "employersName3": "TEST3",
  "otherNationality1": "JO",
  "otherNationality2": "US",
  "workingCountry": "JO",
  "residentStatus": "YES",
  "politicallyExposedPerson": "N",
  "accountBeneficiary": "John Smitt",
  "beneficiaryName": "John Smitt",
  "workingCity": "Baghdad",
  "workingStreetName": "",
  "annualSalary": "12",
  "otherSourceOfIncome": "Mum"
}